CNES,"AQUIRAZ, CE","EUSEBIO, CE","FORTALEZA, CE","JAGUARETAMA, CE","LIMOEIRO DO NORTE, CE","MARACANAU, CE","MARANGUAPE, CE","MASSAPE, CE","REDENCAO, CE","TIANGUA, CE"
CRIO CENTRO REGIONAL INTEGRADO DE ONCOLOGIA,0,0,1,0,0,0,0,0,0,0
HM HOSPITAL DE MESSEJANA DR CARLOS ALBERTO STUDART GOMES,1,1,15,1,0,2,0,1,1,0
HOSP MUNICIPAL DR ARGEU BRAGA HERBSTER,0,0,0,0,0,0,1,0,0,0
HOSPITAL GERAL DR WALDEMAR ALCANTARA,0,0,3,0,0,0,0,0,0,0
HOSPITAL MATERNIDADE MADALENA NUNES,0,0,0,0,0,0,0,0,0,1
HOSPITAL REGIONAL NORTE,0,0,0,0,0,0,0,1,0,0
HOSPITAL SAO RAIMUNDO,0,0,0,0,1,0,0,0,0,0
