CNES,"AQUIRAZ, CE","CAUCAIA, CE","FORTALEZA, CE","IGUATU, CE","IPU, CE","IRAUCUBA, CE","JAGUARETAMA, CE","JUAZEIRO DO NORTE, CE","MARANGUAPE, CE","MORADA NOVA, CE","MOSSORO, RN","PARACURU, CE","PENTECOSTE, CE","QUIXADA, CE","REDENCAO, CE","RUSSAS, CE"
HM HOSPITAL DE MESSEJANA DR CARLOS ALBERTO STUDART GOMES,1,3,13,1,0,0,2,0,0,1,1,1,0,1,1,1
HOSP MATERN PAULO SARASATE,0,0,0,0,0,0,0,0,0,0,0,0,0,0,1,0
HOSP MATERN REG VALE DO CURU,0,0,0,0,0,0,0,0,0,0,0,0,1,0,0,0
HOSP MUN ABELARDO GADELHA DA ROCHA,0,1,0,0,0,0,0,0,0,0,0,0,0,0,0,0
HOSP MUNICIPAL DR ARGEU BRAGA HERBSTER,0,0,0,0,0,0,0,0,1,0,0,0,0,0,0,0
HOSPITAL GERAL DR WALDEMAR ALCANTARA,0,0,5,0,0,0,0,0,0,0,0,0,0,0,0,0
HOSPITAL MATERNIDADE SAO VICENTE DE PAULO HMSVP,0,0,0,0,0,0,0,1,0,0,0,0,0,0,0,0
HOSPITAL MUNICIPAL DR PEDRO DE CASTRO MARINHO,0,0,0,0,0,1,0,0,0,0,0,0,0,0,0,0
HOSPITAL REGIONAL NORTE,0,0,0,0,2,0,0,0,0,0,0,0,0,0,0,0
