CNES,"BEBERIBE, CE","FORTALEZA, CE","ITAPIUNA, CE","JAGUARUANA, CE","JUAZEIRO DO NORTE, CE","MARACANAU, CE","MARANGUAPE, CE","TAMBORIL, CE"
CRIO CENTRO REGIONAL INTEGRADO DE ONCOLOGIA,0,1,0,0,0,0,0,0
HGF HOSPITAL GERAL DE FORTALEZA,0,0,0,0,0,0,1,0
HM HOSPITAL DE MESSEJANA DR CARLOS ALBERTO STUDART GOMES,1,8,1,0,0,1,0,0
HOSPITAL GERAL DR WALDEMAR ALCANTARA,0,2,0,0,0,0,0,0
HOSPITAL MATERNIDADE NOSSA SENHORA DA EXPECTACAO,0,0,0,1,0,0,0,0
HOSPITAL MATERNIDADE SAO VICENTE DE PAULO HMSVP,0,0,0,0,1,0,0,0
HOSPITAL MUNICIPAL RAIMUNDA TIMBO CAMELO TAMBORIL,0,0,0,0,0,0,0,1
