CNES,"CARIRE, CE","CASCAVEL, CE","CAUCAIA, CE","FORTALEZA, CE","HORIZONTE, CE","JIJOCA DE JERICOACOARA, CE","MARACANAU, CE","MARANGUAPE, CE","MONSENHOR TABOSA, CE","MORADA NOVA, CE","PACAJUS, CE","PENTECOSTE, CE","QUIXADA, CE","QUIXERAMOBIM, CE","UBAJARA, CE"
CRIO CENTRO REGIONAL INTEGRADO DE ONCOLOGIA,0,1,0,0,0,0,0,0,0,0,0,0,0,0,0
HM HOSPITAL DE MESSEJANA DR CARLOS ALBERTO STUDART GOMES,0,0,4,7,1,0,2,1,0,1,1,2,1,1,1
HOSP MUN ABELARDO GADELHA DA ROCHA,0,0,1,0,0,0,0,0,0,0,0,0,0,0,0
HOSP MUNICIPAL DR ARGEU BRAGA HERBSTER,0,0,0,0,0,0,0,1,0,0,0,0,0,0,0
HOSPITAL MUNICIPAL DE CARIRE,1,0,0,0,0,0,0,0,0,0,0,0,0,0,0
HOSPITAL REGIONAL NORTE,0,0,0,0,0,1,0,0,1,0,0,0,0,0,0
HOSPITAL UNIVERSITARIO WALTER CANTIDIO,0,0,0,1,0,0,0,0,0,0,0,0,0,0,0
