CNES,"ACOPIARA, CE","BARBALHA, CE","BARRO, CE","CAUCAIA, CE","CRATO, CE","EUSEBIO, CE","FORTALEZA, CE","ITAPIUNA, CE","JUAZEIRO DO NORTE, CE","MARACANAU, CE","MORADA NOVA, CE","PENTECOSTE, CE","QUIXADA, CE","SAO BENEDITO, CE","SAO GONCALO DO AMARANTE, CE","TAUA, CE"
HM HOSPITAL DE MESSEJANA DR CARLOS ALBERTO STUDART GOMES,1,0,0,1,0,1,4,0,0,1,1,1,0,0,1,1
HOSPITAL DR ALBERTO FEITOSA LIMA,0,0,0,0,0,0,0,0,0,0,0,0,0,0,0,1
HOSPITAL MATERNIDADE PROFESSOR WALDEMAR ALCANTARA,0,0,0,0,0,0,0,1,0,0,0,0,0,0,0,0
HOSPITAL MATERNIDADE SAO VICENTE DE PAULO HMSVP,0,1,1,0,1,0,0,0,1,0,0,0,0,0,0,0
HOSPITAL MUNICIPAL DE ACOPIARA PADRE CRISARES SAMPAIO COUTO,1,0,0,0,0,0,0,0,0,0,0,0,0,0,0,0
HOSPITAL MUNICIPAL DR EUDASIO BARROSO HMEB,0,0,0,0,0,0,0,0,0,0,0,0,1,0,0,0
SANTA CASA DE MISERICORDIA DE SOBRAL,0,0,0,0,0,0,0,0,0,0,0,0,0,1,0,0
