CNES,"CAUCAIA, CE","FORTALEZA, CE","ITAITINGA, CE","ITAPAGE, CE","JAGUARUANA, CE","MOMBACA, CE","MORADA NOVA, CE","PARACURU, CE","PEDRA BRANCA, CE","TABULEIRO DO NORTE, CE"
CASA DE SAUDE MATERNIDADE CELESTINA COLARES,0,0,0,0,0,0,0,0,0,1
HM HOSPITAL DE MESSEJANA DR CARLOS ALBERTO STUDART GOMES,1,9,1,1,0,1,2,1,1,0
HOSPITAL DISTRITAL NOSSA SENHORA DA CONCEICAO,0,1,0,0,0,0,0,0,0,0
HOSPITAL MATERNIDADE NOSSA SENHORA DA EXPECTACAO,0,0,0,0,1,0,0,0,0,0
HOSPITAL MUNICIPAL SAO SEBASTIAO E MATERNIDADE CELIA MENDES,0,0,0,0,0,0,0,0,1,0
