CNES,"AQUIRAZ, CE","BARREIRA, CE","BEBERIBE, CE","CANINDE, CE","CAUCAIA, CE","EUSEBIO, CE","FORTALEZA, CE","GENERAL SAMPAIO, CE","HIDROLANDIA, CE","ITAICABA, CE","ITAITINGA, CE","ITAPIPOCA, CE","LIMOEIRO DO NORTE, CE","MARANGUAPE, CE","MORADA NOVA, CE","PACATUBA, CE","QUITERIANOPOLIS, CE","QUIXERAMOBIM, CE","SENADOR POMPEU, CE"
HM HOSPITAL DE MESSEJANA DR CARLOS ALBERTO STUDART GOMES,1,1,1,2,2,1,18,0,0,1,1,3,1,1,1,1,1,1,2
HOSP MATERN JULIA JORGE,0,0,0,0,0,0,0,1,0,0,0,0,0,0,0,0,0,0,0
HOSPITAL HAROLDO JUACABA,0,0,0,0,0,0,2,0,0,0,0,0,0,0,0,0,0,0,0
HOSPITAL MATERNIDADE DR LUIZ DE GONZAGA FONSECA MOTA,0,0,0,0,0,0,0,0,1,0,0,0,0,0,0,0,0,0,0
HOSPITAL REGIONAL FRANCISCO GALVAO DE OLIVEIRA,0,0,0,0,0,0,0,0,0,0,0,0,0,0,1,0,0,0,0
