CNES,"ARACATI, CE","CARIDADE, CE","FORTALEZA, CE","ITAITINGA, CE","ITAPAGE, CE","JAGUARUANA, CE","MARACANAU, CE","MORADA NOVA, CE","PACAJUS, CE","PACOTI, CE","PALHANO, CE","PEDRA BRANCA, CE","QUIXELO, CE","RUSSAS, CE","SAO GONCALO DO AMARANTE, CE","SOBRAL, CE"
HM HOSPITAL DE MESSEJANA DR CARLOS ALBERTO STUDART GOMES,1,1,8,1,1,0,1,1,1,0,1,1,1,0,0,0
HOSPITAL E CASA DE SAUDE DE RUSSAS,0,0,0,0,0,0,0,0,0,0,0,0,0,2,0,0
HOSPITAL GERAL DR WALDEMAR ALCANTARA,0,0,0,0,0,0,0,0,0,0,0,0,0,0,3,0
HOSPITAL MATERNIDADE NOSSA SENHORA DA EXPECTACAO,0,0,0,0,0,1,0,0,0,0,0,0,0,0,0,0
HOSPITAL PADRE QUILIANO E MATERNIDADE DONA NEUSA HOLANDA,0,0,0,0,0,0,0,0,0,1,0,0,0,0,0,0
HOSPITAL REGIONAL NORTE,0,0,0,0,0,0,0,0,0,0,0,0,0,0,0,1
HOSPITAL UNIVERSITARIO WALTER CANTIDIO,0,0,0,0,0,0,0,1,0,0,0,0,0,0,0,0
SANTA CASA DE MISERICORDIA DE SOBRAL,0,0,0,0,0,0,0,0,0,0,0,0,0,0,0,2
