CNES,"AMONTADA, CE","ARACOIABA, CE","BARBALHA, CE","CAPISTRANO, CE","FORTALEZA, CE","IGUATU, CE","INDEPENDENCIA, CE","IRACEMA, CE","JAGUARETAMA, CE","JUAZEIRO DO NORTE, CE","MORADA NOVA, CE","PACATUBA, CE","PENTECOSTE, CE","RUSSAS, CE","TAUA, CE","UBAJARA, CE","UMIRIM, CE"
HM HOSPITAL DE MESSEJANA DR CARLOS ALBERTO STUDART GOMES,1,1,0,0,17,1,1,0,1,0,1,2,0,0,0,0,1
HOSPITAL E CASA DE SAUDE DE RUSSAS,0,0,0,0,0,0,0,0,0,0,0,0,0,1,0,0,0
HOSPITAL E MATERNIDADE MARIA ROQUE DE MACEDO,0,0,0,0,0,0,0,1,0,0,0,0,0,0,0,0,0
HOSPITAL HAROLDO JUACABA,0,0,0,1,1,0,0,0,0,0,0,0,1,0,1,0,0
HOSPITAL MATERNIDADE SAO VICENTE DE PAULO HMSVP,0,0,1,0,0,0,0,0,0,2,0,0,0,0,0,0,0
HOSPITAL MUNICIPAL FRANCISCA BELARMINO DA COSTA,0,0,0,0,0,0,0,0,0,0,0,0,0,0,0,1,0
HOSPITAL UNIVERSITARIO WALTER CANTIDIO,0,0,0,0,2,0,0,0,0,0,0,0,0,0,0,0,0
