CNES,"CAUCAIA, CE","FORTALEZA, CE","IGUATU, CE","JUAZEIRO DO NORTE, CE","LIMOEIRO DO NORTE, CE","MARACANAU, CE","MOMBACA, CE","MORADA NOVA, CE","PACATUBA, CE","PEDRA BRANCA, CE","QUIXELO, CE","REDENCAO, CE","TIANGUA, CE","VARZEA ALEGRE, CE"
CRIO CENTRO REGIONAL INTEGRADO DE ONCOLOGIA,0,1,0,0,0,0,0,0,0,0,0,0,0,0
HGF HOSPITAL GERAL DE FORTALEZA,0,2,0,0,0,0,0,0,0,1,0,0,0,0
HM HOSPITAL DE MESSEJANA DR CARLOS ALBERTO STUDART GOMES,2,13,1,0,0,0,1,0,1,0,1,0,0,0
HOSPITAL HAROLDO JUACABA,0,4,0,0,0,0,0,1,0,0,0,1,0,1
HOSPITAL MATERNIDADE MADALENA NUNES,0,0,0,0,0,0,0,0,0,0,0,0,1,0
HOSPITAL MATERNIDADE SAO VICENTE DE PAULO HMSVP,0,0,0,1,0,0,0,0,0,0,0,0,0,0
HOSPITAL MUNICIPAL DR JOAO ELISIO DE HOLANDA,0,0,0,0,0,2,0,0,0,0,0,0,0,0
HOSPITAL SAO RAIMUNDO,0,0,0,0,1,0,0,0,0,0,0,0,0,0
